{
  "$schema": "../schemas/cybernetic_control_kernel.v1.schema.json",
  "schema_version": "cybernetic_control_kernel.v1",
  "generated_at": "2026-05-09",
  "system_boundary": {
    "system_name": "vela-research-workflow-environment",
    "source_of_truth_repo": "<VELA_SOURCE_ROOT>",
    "managed_repositories": [
      "<VELA_SOURCE_ROOT>"
    ],
    "out_of_scope": [
      "Direct mutation of VELA runtime contracts without an explicit promotion task",
      "Bulk import of external GitHub repositories as a runtime replacement",
      "Formal academic citation from unverified PDFs, fabricated DOI values, unverifiable source metadata, or missing DOI-waiver evidence"
    ]
  },
  "source_material": [
    {
      "id": "engineering-cybernetics-en",
      "title": "Engineering Cybernetics",
      "language": "en",
      "local_path": "<REFERENCE_LIBRARY>\\engineering-cybernetics-en.pdf",
      "status": "verified",
      "formal_citation_status": "local_source_only"
    },
    {
      "id": "engineering-cybernetics-zh-vol1",
      "title": "工程控制论 上册 第三版",
      "language": "zh",
      "local_path": "<REFERENCE_LIBRARY>\\engineering-cybernetics-zh-vol1.pdf",
      "status": "verified",
      "formal_citation_status": "local_source_only"
    },
    {
      "id": "engineering-cybernetics-zh-vol2",
      "title": "工程控制论 下册 第三版",
      "language": "zh",
      "local_path": "<REFERENCE_LIBRARY>\\engineering-cybernetics-zh-vol2.pdf",
      "status": "verified",
      "formal_citation_status": "local_source_only"
    }
  ],
  "control_objectives": [
    {
      "id": "research-integrity",
      "name": "Research integrity",
      "description": "Keep formal claims, citations, evidence capture, and reproducibility gates auditable before delivery.",
      "owner": "research-autopilot",
      "signals": [
        "validator_result.v1",
        "citation verification output",
        "quality gate logs"
      ],
      "gates": [
        "validate_research_pipeline",
        "validate_agents_contract"
      ]
    },
    {
      "id": "environment-stability",
      "name": "Environment stability",
      "description": "Keep skills, profiles, schemas, MCP configuration, runtime snapshots, and VELA handoff contracts consistent.",
      "owner": "vela-runtime-manager",
      "signals": [
        "runtime skill drift",
        "cross repository drift",
        "daily cybernetics audit"
      ],
      "gates": [
        "validate_research_stack",
        "envctl validate drift"
      ]
    },
    {
      "id": "adaptive-learning",
      "name": "Adaptive learning",
      "description": "Admit durable lessons through a controlled retrospective loop instead of silent route or skill mutation.",
      "owner": "project-retrospective-evolver",
      "signals": [
        "project friction",
        "route correction",
        "repeated manual workflow"
      ],
      "gates": [
        "envctl validate cybernetics",
        "vela-runtime-manager proposal review"
      ]
    }
  ],
  "controlled_variables": [
    {
      "id": "route-selection",
      "name": "Route selection",
      "description": "The route chosen by research-autopilot for each task type and project scope, with user confirmation before a new route or chain is entered.",
      "owner": "research-autopilot"
    },
    {
      "id": "skill-memory-placement",
      "name": "Skill and memory placement",
      "description": "The placement of durable logic, reusable procedures, long-form interpretation, and transient facts.",
      "owner": "vela-runtime-manager"
    },
    {
      "id": "contract-validity",
      "name": "Contract validity",
      "description": "Schema-valid catalogs, dispatch artifacts, validator envelopes, and snapshot boundaries.",
      "owner": "envctl"
    },
    {
      "id": "research-stage-progression",
      "name": "Research stage progression",
      "description": "The confirmed transition from one research milestone to the next, including literature acquisition, structured reading, PDF evidence annotation, drafting, figures, review, revision, polishing, language review, and formatting.",
      "owner": "research-autopilot"
    },
    {
      "id": "project-folder-hygiene",
      "name": "Project folder hygiene",
      "description": "The organization state of each thread's target project folder, including temporary artifacts, dead files, stale outputs, duplicate drafts, evidence preservation, and handoff readability.",
      "owner": "project-folder-hygiene"
    },
    {
      "id": "subagent-context-load",
      "name": "Subagent context load",
      "description": "The share of context-heavy reading, searching, inventory, testing, and review work delegated to isolated subagent contexts while the main context keeps only routing, decisions, and integration state.",
      "owner": "research-team-orchestrator"
    },
    {
      "id": "external-adoption-pressure",
      "name": "External adoption pressure",
      "description": "The inflow of GitHub patterns, plugins, MCP servers, skills, and harness ideas.",
      "owner": "skill-vetter"
    }
  ],
  "feedback_signals": [
    {
      "id": "validator-feedback",
      "name": "Validator feedback",
      "description": "Structured pass, needs_review, or fail results from envctl and legacy validators.",
      "owner": "envctl"
    },
    {
      "id": "retrospective-feedback",
      "name": "Project retrospective feedback",
      "description": "Project-end friction, repeated prompts, missing routing logic, and proposed skill changes.",
      "owner": "project-retrospective-evolver"
    },
    {
      "id": "knowledge-feedback",
      "name": "Knowledge feedback",
      "description": "Zotero verification, Obsidian sync packages, and writing-reference capture records.",
      "owner": "zotero-sync / obsidian-research-sync"
    },
    {
      "id": "daily-audit-feedback",
      "name": "Daily audit feedback",
      "description": "Proposal-only reports from the cybernetics daily skill audit automation.",
      "owner": "vela-runtime-manager"
    },
    {
      "id": "folder-hygiene-feedback",
      "name": "Folder hygiene feedback",
      "description": "Git status, file inventory, removed or retained artifact lists, and needs-user-decision cleanup reports from project-folder-hygiene.",
      "owner": "project-folder-hygiene"
    }
  ],
  "controllers": [
    {
      "id": "research-autopilot",
      "name": "Research Autopilot",
      "description": "Sole total router for research tasks, profile choice, helper skills, and route cards.",
      "owner": "research-autopilot"
    },
    {
      "id": "vela-runtime-manager",
      "name": "VELA Runtime Manager",
      "description": "Governance controller for VELA skills, plugins, MCP profiles, reports, and recurring update proposals.",
      "owner": "vela-runtime-manager"
    },
    {
      "id": "envctl",
      "name": "Environment Control CLI",
      "description": "Typed command and validator layer used by local operators and optional local dashboards.",
      "owner": "skills/scripts/envctl"
    },
    {
      "id": "project-retrospective-evolver",
      "name": "Project Retrospective Evolver",
      "description": "Adaptive controller that decides whether a project produces no change, skill update, new skill, or routing fix.",
      "owner": "project-retrospective-evolver"
    }
  ],
  "actuators": [
    {
      "id": "skills",
      "name": "Skills",
      "description": "Reusable procedural behavior and domain workflows.",
      "owner": "skills directory"
    },
    {
      "id": "schemas-catalogs",
      "name": "Schemas and catalogs",
      "description": "Typed contracts for routing, project initialization, handoffs, validation, and control logic.",
      "owner": "skills/schemas and skills/catalog"
    },
    {
      "id": "automations",
      "name": "Codex automations",
      "description": "Recurring proposal-only checks before any autonomous mutation is approved.",
      "owner": "Codex App automations"
    },
    {
      "id": "local-dashboard",
      "name": "Optional local dashboard",
      "description": "Optional management surface that invokes envctl and consumes snapshots without becoming the source of truth.",
      "owner": "external-dashboard"
    }
  ],
  "disturbance_classes": [
    {
      "id": "path-drift",
      "name": "Path drift",
      "description": "Old local roots, stale plugin cache paths, and mismatched runtime cwd values.",
      "owner": "cross_repo_drift"
    },
    {
      "id": "upstream-change",
      "name": "Upstream change",
      "description": "New plugin, MCP, GitHub, or Codex native feature updates that may tempt uncontrolled adoption.",
      "owner": "skill-vetter"
    },
    {
      "id": "citation-noise",
      "name": "Citation noise",
      "description": "Unverified references, fabricated DOI values, missing DOI-waiver evidence, and discovery results incorrectly promoted into formal bibliography.",
      "owner": "citation-verifier"
    },
    {
      "id": "context-loss",
      "name": "Context loss",
      "description": "Thread compaction, missing handoff, project memory drift, or repeated reconstruction of the same workflow.",
      "owner": "project-retrospective-evolver"
    },
    {
      "id": "workspace-clutter",
      "name": "Workspace clutter",
      "description": "Temporary files, stale intermediate outputs, duplicate drafts, dead code, dead folders, and unclassified artifacts that make a project harder to continue or review.",
      "owner": "project-folder-hygiene"
    }
  ],
  "stability_metrics": [
    {
      "id": "validator-pass-rate",
      "name": "Validator pass rate",
      "description": "All required validators pass before commits, runtime snapshots, or autonomous evolution.",
      "owner": "envctl",
      "gates": [
        "contracts",
        "stack",
        "initializer-policy",
        "helm-snapshot",
        "drift",
        "cybernetics"
      ]
    },